{
  "standard": "2.0",
  "api": "2.0",
  "requires": {
    "core": ">=1.1",
    "permissions": ">=1.1",
    "render": ">=1.1",
    "scheduler": ">=1.1",
    "vector": ">=1.1"
  },
  "id": "shyne.lua_api_2_0_example",
  "name": "Shyne Lua API 2.0 Example",
  "version": "1.0.0",
  "replace_vanilla": false,
  "online_sync": false,
  "permissions": [
    "hud_render"
  ]
}
